{
  "schema_version": "1.0.0",
  "id": "claim_full-lc-rmse-discriminator-works",
  "kind": "claim_card",
  "deck": "research",
  "statement": "After the times[0]==0 gauge fix, full-LC RMSE is a STRONG discriminator: it ranks truth 4/79k on seed 116; windowing HURTS; density is the lever. (N=1 seed 116.)",
  "supporting_runs": [
    "s093_fullc_score_survivors",
    "s097_times0_gauge_bug_audit"
  ],
  "refuting_runs": [],
  "trust_stamp": {
    "confidence": "medium",
    "gates_passed": [],
    "oracle_clean": false
  },
  "scope": {
    "N": 1,
    "kind": "N1"
  },
  "depends_on": [
    "propagator@2.0.0",
    "surrogate@v2",
    "scorer@1.0.0"
  ],
  "status": "live",
  "superseded_by": null,
  "supersedes": "claim_full-lc-rmse-fails-needs-windowing",
  "links_to_writeups": [
    "notebooks/inversion/survey/experiments/s093_fullc_score_survivors.md"
  ],
  "created_at": "2026-06-01T00:00:00Z",
  "updated_at": "2026-06-01T00:00:00Z"
}
