{
  "schema_version": "1.0.0",
  "id": "claim_cloud-data-proven-on-seed89",
  "kind": "claim_card",
  "deck": "research",
  "statement": "The cloud-data architecture is PROVEN to land Band A on seed 89. RETRACTED: the Band A rows were oracle-injected truth-cluster polish (truth looked up by cluster_id); without injection truth ranks 107/325 (seed 89) / 390/25k (seed 28). The headline yield was an oracle-leak artefact, not an architecture result.",
  "supporting_runs": [],
  "refuting_runs": [
    "s058_lm_polish_clusters"
  ],
  "trust_stamp": {
    "confidence": "low",
    "gates_passed": [],
    "oracle_clean": false
  },
  "scope": {
    "N": 1,
    "kind": "N1"
  },
  "depends_on": [
    "propagator@1.0.0",
    "surrogate@v2",
    "scorer@1.0.0"
  ],
  "status": "retracted",
  "superseded_by": null,
  "supersedes": null,
  "links_to_writeups": [
    "notebooks/inversion/survey/experiments/s058_lm_polish_clusters.md",
    "memory/feedback_oracle_injection_taints_yield.md"
  ],
  "created_at": "2026-06-01T00:00:00Z",
  "updated_at": "2026-06-01T00:00:00Z"
}
