{
  "schema_version": "1.0.0",
  "id": "claim_anchor-aliasing-is-the-blocker",
  "kind": "claim_card",
  "deck": "research",
  "statement": "The binding blocker to blind inversion on seed 119 is anchor-baseline aliasing (the single finite-diff shoot aliasing the truth pair).",
  "supporting_runs": ["s099"],
  "refuting_runs": ["s100"],
  "trust_stamp": {
    "confidence": "low",
    "gates_passed": [],
    "oracle_clean": true
  },
  "scope": { "N": 1, "kind": "N1" },
  "depends_on": ["propagator@2.0.0", "surrogate@v2", "scorer@1.0.0"],
  "status": "superseded",
  "superseded_by": "claim_hard-shoot-trap-is-the-blocker",
  "supersedes": null,
  "links_to_writeups": [
    "notebooks/inversion/survey/experiments/s100_coverage_closes_starvation.md"
  ],
  "created_at": "2026-05-26T09:00:00Z",
  "updated_at": "2026-05-28T10:00:00Z"
}
