{
  "schema_version": "1.0.0",
  "id": "claim_omega-bracket-held-out-20-of-20",
  "kind": "claim_card",
  "deck": "research",
  "statement": "The blind s019 LS-|omega| harmonic-division bracket, clamped to the physical [0.1,1.5] deg/s prior and applied HELD-OUT to cohort seeds 100-119, brackets truth-|omega| on 20/20 seeds. Enables blind two-stage inversion (116 in 705s).",
  "supporting_runs": [
    "s099_blind_fast_invert_116"
  ],
  "refuting_runs": [],
  "trust_stamp": {
    "confidence": "high",
    "gates_passed": [],
    "oracle_clean": true
  },
  "scope": {
    "N": 20,
    "kind": "cohort"
  },
  "depends_on": [
    "propagator@2.0.0",
    "surrogate@v2",
    "scorer@1.0.0"
  ],
  "status": "live",
  "superseded_by": null,
  "supersedes": null,
  "links_to_writeups": [
    "notebooks/inversion/survey/experiments/s099_blind_fast_invert_116.md",
    "notebooks/inversion/survey/experiments/s019_ls_bracket_omega_mag.md"
  ],
  "created_at": "2026-06-01T00:00:00Z",
  "updated_at": "2026-06-01T00:00:00Z"
}
