{
  "schema_version": "1.0.0",
  "id": "claim_pol-diam-predicts-basin-width",
  "kind": "claim_card",
  "deck": "research",
  "statement": "Polhode DIAMETER predicts joint-LM basin width better than |omega| (Spearman rho=-0.94, p<0.001, cohort n=100) and far better than the polhode LABEL (rho=+0.11, uncorrelated). EVIDENCE IS PRE-FIX (s042/s053 ran on propagator 1.0.0); basin-width numbers are exactly the class the omega-sign fix invalidated -> needs re-measurement under 2.0.0.",
  "supporting_runs": [
    "s053_cohort_polhode_survey",
    "s042_basin_radius_cohort"
  ],
  "refuting_runs": [],
  "trust_stamp": {
    "confidence": "medium",
    "gates_passed": [],
    "oracle_clean": false
  },
  "scope": {
    "N": 100,
    "kind": "cohort"
  },
  "depends_on": [
    "propagator@1.0.0",
    "surrogate@v2",
    "scorer@1.0.0"
  ],
  "status": "needs_replication",
  "superseded_by": null,
  "supersedes": null,
  "links_to_writeups": [
    "notebooks/inversion/survey/experiments/s053_cohort_polhode_survey.md",
    "memory/project_omega_mag_basin_scales_with_omega.md"
  ],
  "created_at": "2026-06-01T00:00:00Z",
  "updated_at": "2026-06-01T00:00:00Z"
}
