{
  "schema_version": "1.0.0",
  "id": "claim_omega-reported-in-degps",
  "kind": "claim_card",
  "deck": "preference",
  "statement": "Report |ω| in deg/s, never rad/s (×57.29578). Standing preference — applies to every metric, plot axis, and writeup.",
  "supporting_runs": [],
  "refuting_runs": [],
  "trust_stamp": {
    "confidence": "high",
    "gates_passed": [],
    "oracle_clean": true
  },
  "scope": { "N": 0, "kind": "N1" },
  "depends_on": [],
  "status": "live",
  "superseded_by": null,
  "supersedes": null,
  "links_to_writeups": ["~/.claude/.../memory/feedback_omega_mag_units_degrees.md"],
  "confirmed_by": "girish",
  "created_at": "2026-05-28T08:00:00Z",
  "updated_at": "2026-05-28T08:00:00Z"
}
