{
  "schema_version": "1.0.0",
  "id": "claim_windowed-photometry-breaks-hard-shoot-trap",
  "kind": "claim_card",
  "deck": "research",
  "statement": "On seed 119, free-ω LM-minimization of photometry over a forward A→C window (window-as-objective) escapes the hard-shoot trap and recovers Band A (ρ 0.0300, ω-err 0.57°), where hard-connecting the endpoints gives Band D. SCOPE: N=1, and the seed run was oracle-seeded — discrimination against far/phantom pairs is untested.",
  "supporting_runs": ["s106"],
  "refuting_runs": [],
  "trust_stamp": {
    "confidence": "medium",
    "gates_passed": ["conservation-smoke"],
    "oracle_clean": false
  },
  "scope": { "N": 1, "kind": "N1" },
  "depends_on": ["propagator@2.0.0", "surrogate@v2", "scorer@1.0.0"],
  "status": "live",
  "superseded_by": null,
  "supersedes": null,
  "links_to_writeups": ["notebooks/inversion/survey/experiments/s106_windowed_photometry_polish.md"],
  "created_at": "2026-05-28T12:05:00Z",
  "updated_at": "2026-05-28T12:05:00Z"
}
